"itemnumber","productname","group","KJ","protein","fat","carbohydrates","weight","weight_unit","food_list","datasource"
"00000087177756","7Up","Plant-based foods and beverages,Beverages,Plant-based beverages,Carbonated drinks,Fruit-based beverages,Sodas,Fruit sodas,Lemon soft drinks,Sweetened beverages",177,0,0,10.4,"33","cl","eau gazéifiée, sucre, acidifiants (acide citrique, acide malique), arômes (extraits naturels de citron et de citron vert), correcteur d'acidité (citrate de sodium)","openfoodfacts"
"00000000000915","Miel de Pays (Fleurs)","Breakfasts,Spreads,Sweet spreads,Bee products,Farming products,Sweeteners,Honeys,Flower honeys",NA,NA,NA,NA,"250","g",NA,"openfoodfacts"
"00000093718738","Horseradish cream",NA,NA,NA,NA,NA,"175","g","water, horseradish, mustard seed, sugar, vegetable oil, salt, food acid, whey protein, butter, modified corn starch, xanthan gum, sodium metabisulphite, color (paprika oleoresin)","openfoodfacts"
"00000100292688","Air Minuman",NA,NA,NA,NA,NA,"1500","ml",NA,"openfoodfacts"
"00000000001002","Confiture de gratte-cul",NA,NA,NA,NA,NA,"360","g",NA,"openfoodfacts"
"00000000001003","Miel d'acacia","Breakfasts,Spreads,Sweet spreads,Bee products,Farming products,Sweeteners,Honeys,Acacia honeys",NA,NA,NA,NA,"1","kg",NA,"openfoodfacts"
"00000101209159","Véritable pâte à tartiner noisettes chocolat noir","Breakfasts,Spreads,Sweet spreads,fr:Pâtes à tartiner,Hazelnut spreads,Chocolate spreads,Cocoa and hazelnuts spreads",2582,8,48,36,"350","g",NA,"openfoodfacts"
"00000000001038","Rillettes de truite de Bordeaux au citron confit",NA,715,12,12,3.5,"90","g",NA,"openfoodfacts"
"00000105200923","Lagg's, kidneytea, herbal tea","Plant-based foods and beverages,Beverages,Hot beverages,Plant-based beverages,Teas,Tea bags",0,0,0,3.33,NA,NA,"shave grass, corn silk, uva ursi, juliana adstringen, boldo, hibiscus flowers, orange blossom.","openfoodfacts"
"00000105200961","Lagg's, bronchtea","Plant-based foods and beverages,Beverages,Hot beverages,Plant-based beverages,Teas,Tea bags",0,0,0,100,NA,NA,"eucalyptus licorice ginger elder mullein cinnamon orange blossom.","openfoodfacts"
"00000000001053","Miel de Garrigues",NA,NA,NA,NA,NA,"250","g",NA,"openfoodfacts"
"00000105753078","Bread","Plant-based foods and beverages,Plant-based foods,Cereals and potatoes,Breads",NA,NA,NA,NA,NA,NA,"water, white flour, honey, corn syrup, yeast, salt, cheddar, and garlic.","openfoodfacts"
"00000111048403","100% Pure Canola Oil","Plant-based foods and beverages,Plant-based foods,Fats,Vegetable fats,Vegetable oils",3586,0,100,0,NA,NA,"100% canola oil no additives or preservatives","openfoodfacts"
"00000111301201","Original Buttery Spread","Fats",2690,0,71.43,0,NA,NA,"canola oil, water, palm oil, palm kernel oil, contains less than 2% of salt, whey powder (milk), vegetable mono & diglycerides, soy lecithin (soy), potassium sorbate (a preservative), citric acid, natural & artificial flavors, di-alpha-tocopherol acetate (vitamin e), vitamin a palmitate, beta carotene (color), vitamin d3. contains milk & soy.","openfoodfacts"
"00000111301263","Canola harvest, buttery spread, with flaxseed oil","Fats",2389,0,57.14,0,NA,NA,"canola oil, water, palm oil, flax oil, palm kernel oil, whey powder (milk), salt, vegetable mono and diglycerides, soybean lecithin, potassium sorbate (preservative), citric acid, artificial flavor, vitamin e (dl-alpha-tocopherol acetate), calcium disodium edta (to preserve freshness), vitamin a palmitate, beta-carotene, vitamin d3.","openfoodfacts"
"00000000001113","Pâté de sanglier supérieur truffé à 4 %","Plant-based foods and beverages,Plant-based foods,Spreads,Nuts and their products,Plant-based spreads,Oilseed purees,Nut butters,Almond butters",2746,21.875,53.125,18.75,"170","g",NA,"openfoodfacts"
"00000112301878",NA,NA,109,NA,NA,NA,NA,NA,"eau, légumes 27 % (carotte, navet, poireau, pomme de terre, chou vert, céleri, oignon), viande de bœuf cuite 2,2 %, amidon transformé de pomme de terre, sel, arômes (contient : lait, céleri), huile de colza, girofle en poudre, exhausteur de goût: glutamate de sodium, extraits naturels de thym, de laurier et de poivre. peut contenir des traces de blé et œuf .","openfoodfacts"
"00000112302619",NA,NA,84,0.6,0.4,3.1,NA,NA,"eau, légumes 15 % (oignon, carotte, pousses de bambou, céleri, poivron, poireau), vermicelles cuits 5 % (semoule de blé, blanc d’œuf), champignons noirs 2,4 %, amidon transformé de pomme de terre, arômes (contient céleri), sel, graisse de poule 'antioxydant: extrait de romarin), piment de cayenne, lait écrémé en poudre","openfoodfacts"
"00000120497216","Organix Kids mandarin & Apple",NA,NA,NA,NA,NA,"21","",NA,"openfoodfacts"
"00000123457934","<U+062E><U+0628><U+0632> <U+0634><U+0631><U+0627><U+0626><U+062D> <U+0627><U+0628><U+064A><U+0636> <U+0645><U+062A><U+0648><U+0633><U+0637>","ar:<U+062E><U+0628><U+0632>",NA,NA,NA,NA,"600","<U+062C><U+0631><U+0627><U+0645>",NA,"openfoodfacts"
"00000000001239",NA,"Prawn-sandwich",NA,NA,NA,NA,"200","g",NA,"openfoodfacts"
"00000127534563","German fine bread","Plant-based foods and beverages,Plant-based foods,Cereals and potatoes,Breads",1100,7.02,3.51,52.63,NA,NA,"rye flour, water, whole wheat flour, bran flour, malt, molasses, rye meal, caraway seeds, salt, yeast.","openfoodfacts"
"00000127534570",NA,NA,NA,NA,NA,NA,"22","oz",NA,"openfoodfacts"
"00000127534587","Today's temptations, lithuanian rye bread","Plant-based foods and beverages,Plant-based foods,Cereals and potatoes,Breads",954,5.26,2.63,47.37,NA,NA,"rye flour, water, wheat, flour, malt, molasses, sugar, onion, yeast, caraway seeds, salt.","openfoodfacts"
"00000130008136","Escalope de dinde","Meats and their products,Meats,Poultries,Turkey and its products,Turkeys,Turkey cutlets",NA,NA,NA,NA,"300","g",NA,"openfoodfacts"
"00000000001328","Harvest whole wheat bread","Plant-based foods and beverages,Plant-based foods,Snacks,Cereals and potatoes,Sweet snacks,Breads,Viennoiseries,White breads,Chouquettes",973,11.627906976744,4.6511627906977,41.860465116279,NA,NA,"whole wheat flour, water, wheat gluten, honey, yeast, expeller pressed canola oil, wheat bran, contains less than 2% of cultured whole wheat flour with vinegar (for freshness), salt, soy lecithin (an emulsifier), wheat starch, distilled white vinegar, ascorbic acid, enzymes. contains: wheat, soy.","openfoodfacts"
"00000137007224","Croissant pure beurre X2","Snacks,Sweet snacks,Viennoiseries,Croissants,Butter croissants",1795,9.7,23.9,42.5,"100","g","farine de ble, eau, beurre (lait) 22%, sucre, levure, gluten de ble, sel, œuf, agent de traitement de la farine: acide ascorbique, enzymes, poudre de crème (lait), levain d'epeautre, farine de ble malté, malt d orge.","openfoodfacts"
"00000000001373","Spring onion","Plant-based foods and beverages,Plant-based foods,Condiments,Fruits and vegetables based foods,Culinary plants,Vegetables based foods,Aromatic plants,Fresh foods,Aromatic herbs,Fresh plant-based foods,Onions and their products,Fresh vegetables,Groceries",NA,NA,NA,NA,"6","","spring onions","openfoodfacts"
"00000140323687","Madeleine Framboise","Snacks,Sweet snacks,Biscuits and cakes,Cakes,Madeleines",NA,NA,NA,NA,"110","g",NA,"openfoodfacts"
"00000000001427",NA,NA,NA,NA,NA,NA,"500","g",NA,"openfoodfacts"
